{"approval":{"approval_id":"approval-01","approver_id":"approver-operator","approver_role":"operator","decision":"approve","expires_at":"2026-09-05T15:04:10Z","intent_sha256":"d13e88ab6f40e6b0326c914d9ca68258eb066723b26b154315ea07ec06df4d6d","issued_at":"2026-09-05T15:00:10Z","nonce":"approval-01-nonce"},"campaign_id":"luremandate-conformance-v1","plan_sha256":"034d002b81c30e2ceeb6690c643828874cde8e1c1769015a82402c2cad401641","schema":"https://github.com/immu4989/lurebench/spec/luremandate-approval-statement-v1","schema_version":1}
