{"approval":{"approval_id":"approval-12-mission","approver_id":"approver-mission","approver_role":"mission-owner","decision":"approve","expires_at":"2026-09-05T15:12:50Z","intent_sha256":"8241185d5d8b43c838152d7d2dd20abfe3ac9d26124afa2e2ea8566a0059329a","issued_at":"2026-09-05T15:11:10Z","nonce":"approval-12-mission-nonce"},"campaign_id":"luremandate-conformance-v1","plan_sha256":"034d002b81c30e2ceeb6690c643828874cde8e1c1769015a82402c2cad401641","schema":"https://github.com/immu4989/lurebench/spec/luremandate-approval-statement-v1","schema_version":1}
