{"approval":{"approval_id":"approval-08","approver_id":"approver-mission","approver_role":"mission-owner","decision":"approve","expires_at":"2026-09-05T15:08:50Z","intent_sha256":"15b4c69e7cb96af2273094f4320e58cf7b1f440b080edcca76267e3b77dec1fc","issued_at":"2026-09-05T15:07:10Z","nonce":"approval-08-nonce"},"campaign_id":"luremandate-conformance-v1","plan_sha256":"034d002b81c30e2ceeb6690c643828874cde8e1c1769015a82402c2cad401641","schema":"https://github.com/immu4989/lurebench/spec/luremandate-approval-statement-v1","schema_version":1}
