{"approval":{"approval_id":"approval-02-security","approver_id":"approver-security","approver_role":"security-reviewer","decision":"approve","expires_at":"2026-09-05T15:02:50Z","intent_sha256":"c8100cfd46a5da73588dba2a0ebf0918d6dcc597aebbe0ba275c6bf2f4a943ea","issued_at":"2026-09-05T15:01:10Z","nonce":"approval-02-security-nonce"},"campaign_id":"luremandate-conformance-v1","plan_sha256":"034d002b81c30e2ceeb6690c643828874cde8e1c1769015a82402c2cad401641","schema":"https://github.com/immu4989/lurebench/spec/luremandate-approval-statement-v1","schema_version":1}
