{"approval":{"approval_id":"approval-03","approver_id":"requester-a","approver_role":"requester","decision":"approve","expires_at":"2026-09-05T15:06:10Z","intent_sha256":"c7e14abd9a218bb9c618fc310a79358fc917a04f2b65d6527b9de80b01810721","issued_at":"2026-09-05T15:02:10Z","nonce":"approval-03-nonce"},"campaign_id":"luremandate-conformance-v1","plan_sha256":"034d002b81c30e2ceeb6690c643828874cde8e1c1769015a82402c2cad401641","schema":"https://github.com/immu4989/lurebench/spec/luremandate-approval-statement-v1","schema_version":1}
